{
  "schemaVersion": "1.0",
  "cohortId": "cohort-4b5b5f377a1b",
  "launchId": "integrated-robotic-handling-v3",
  "measurementConditionsSha256": "197395fe837aedf58dc04b817d6db29f5005a0e61169e8b370a05a4740541200",
  "disclosedAt": "2026-07-30T09:39:23Z",
  "modelGroups": [
    {
      "groupId": "group-6a2e9d0f13b4",
      "runIds": [
        "run-aeef1716db18",
        "run-96103c9f6c9a",
        "run-c950df7607b5"
      ],
      "model": {
        "provider": "OpenAI",
        "name": "gpt-5.6-terra",
        "version": "gpt-5.6-terra",
        "reasoningSetting": "medium",
        "policy": "Requested Luna medium was unavailable; all three independent runs used the exact declared fallback gpt-5.6-terra at medium reasoning with zero human engineering intervention."
      }
    }
  ]
}
